{
  "schemaVersion": 1,
  "modem": {
    "driver": "android-telephony",
    "endpoint": "default-subscription",
    "baud": 115200,
    "pollIntervalMs": 3000
  },
  "receiver": "",
  "adminPhone": "",
  "numberBlacklist": "",
  "forwardRules": "",
  "callNotifyEnabled": true,
  "pushEnabled": true,
  "pushChannels": [
    {"enabled": false, "type": 1, "name": "通道1", "url": "", "key1": "", "key2": "", "customBody": ""},
    {"enabled": false, "type": 1, "name": "通道2", "url": "", "key1": "", "key2": "", "customBody": ""},
    {"enabled": false, "type": 1, "name": "通道3", "url": "", "key1": "", "key2": "", "customBody": ""},
    {"enabled": false, "type": 1, "name": "通道4", "url": "", "key1": "", "key2": "", "customBody": ""},
    {"enabled": false, "type": 1, "name": "通道5", "url": "", "key1": "", "key2": "", "customBody": ""}
  ],
  "email": {"enabled": false, "server": "", "port": 465, "username": "", "password": "", "recipient": ""},
  "storage": {"inboxFile": ""},
  "web": {"username": "admin", "password": "admin123", "listenAddress": "127.0.0.1", "port": 8080, "assetRoot": ""},
  "time": {
    "timezoneOffsetMin": 480,
    "ntpServer": "pool.ntp.org",
    "rebootEnabled": false,
    "rebootHour": 4,
    "heartbeatEnabled": false,
    "heartbeatHour": 9
  },
  "keepalive": {
    "enabled": false,
    "intervalDays": 175,
    "action": 1,
    "target": "",
    "url": "http://gg.incrafttime.top/api/payload?size=64342",
    "profile": "",
    "lastRun": 0
  },
  "scheduledTasks": [
    {"enabled": false, "name": "定时任务1", "profile": "", "switchBack": true, "intervalDays": 30, "action": 0, "target": "", "payload": "", "lastRun": 0},
    {"enabled": false, "name": "定时任务2", "profile": "", "switchBack": true, "intervalDays": 30, "action": 0, "target": "", "payload": "", "lastRun": 0},
    {"enabled": false, "name": "定时任务3", "profile": "", "switchBack": true, "intervalDays": 30, "action": 0, "target": "", "payload": "", "lastRun": 0},
    {"enabled": false, "name": "定时任务4", "profile": "", "switchBack": true, "intervalDays": 30, "action": 0, "target": "", "payload": "", "lastRun": 0},
    {"enabled": false, "name": "定时任务5", "profile": "", "switchBack": true, "intervalDays": 30, "action": 0, "target": "", "payload": "", "lastRun": 0},
    {"enabled": false, "name": "定时任务6", "profile": "", "switchBack": true, "intervalDays": 30, "action": 0, "target": "", "payload": "", "lastRun": 0}
  ]
}
